{
  "schema_version": "1.0",
  "effect_id": "effect-speech-001",
  "session_id": "session-001",
  "plan_id": "plan-navigate-001",
  "type": "speech",
  "created_at": "2026-09-22T00:00:01Z",
  "payload": {
    "text": "I am looking up People's Hospital.",
    "priority": "normal",
    "interruptible": true
  }
}
